name,address,lat,lng
김해봉황초등학교,경상남도 김해시 전하동 518,35.2221401,128.869829
칠산초등학교,경상남도 김해시 화목동 773-1,35.2096633,128.8519631
어방초등학교,경상남도 김해시 어방동 767-3,35.2397489,128.8980078
신어초등학교,경상남도 김해시 삼방동 200,35.2438086,128.9113876
대운초등학교,경상남도 양산시 삼호동 886-2,35.4087147,129.173519
고현초등학교,경상남도 남해군 고현면 대사리 618,34.8970508,127.8775081
도마초등학교,경상남도 남해군 고현면 도마리 137,34.8700562,127.8923687
설천초등학교,경상남도 남해군 설천면 남양리 71,34.926299,127.9145925
하동초등학교,경상남도 하동군 하동읍 광평리 299,35.0669284,127.747771
기계초등학교,경상북도 포항시 북구 기계면 현내리 955-1,36.0721296,129.2035901
악양초등학교,경상남도 하동군 악양면 정서리 285-2,35.1618459,127.7085829
쌍계초등학교,경상남도 하동군 화개면 운수리 328-26,35.2325117,127.6448735
화개초등학교,경상남도 하동군 화개면 삼신리 594-2,35.1992881,127.6288055
적량초등학교,경상남도 하동군 적량면 관리 136-2,35.0856062,127.773542
횡천초등학교,경상남도 하동군 횡천면 횡천리 752,35.1105681,127.8077303
고남초등학교,경상남도 하동군 고전면 전도리 417,35.0008681,127.7976858
고전초등학교,경상남도 하동군 고전면 범아리 318,35.0249901,127.818203
북천초등학교,경상남도 하동군 북천면 직전리 677-1,35.1136409,127.8891057
묵계초등학교청암분교장,경상남도 하동군 청암면 평촌리 590-2,35.1594759,127.7976755
옥종초등학교,경상남도 하동군 옥종면 청룡리 143-2,35.1810712,127.8826292
진교초등학교,경상남도 하동군 진교면 진교리 466,35.0340977,127.8990945
진정초등학교,경상남도 하동군 금남면 진정리 555-1,34.9859694,127.8242065
노량초등학교,경상남도 하동군 금남면 송문리 759-2,34.9517164,127.856796
궁항초등학교,경상남도 하동군 금성면 궁항리 1038,34.9711901,127.796129
묵계초등학교,경상남도 하동군 청암면 묵계리 550,35.2289609,127.7346619
갈육초등학교,경상남도 하동군 금성면 갈사리 376-2,34.9487601,127.7840257
중문초등학교,제주특별자치도 서귀포시 중문동 1984,33.2522914,126.4296917
토평초등학교,제주특별자치도 서귀포시 토평동 1210-1,33.2659324,126.5895984
서호초등학교,제주특별자치도 서귀포시 호근동 1421-5,33.2536342,126.5294228
흥해서부초등학교,경상북도 포항시 북구 흥해읍 매산리 1-6,36.1155697,129.3144229
흥해초등학교,경상북도 포항시 북구 흥해읍 약성리 100,36.1141912,129.3466414
대보초등학교,경상북도 포항시 남구 호미곶면 구만리 123,36.0782949,129.5572291
남성초등학교,경상북도 포항시 남구 대송면 송동리 795,35.9701024,129.3595815
대송초등학교,경상북도 포항시 남구 대송면 제내리 974,35.9842561,129.362628
동해초등학교,경상북도 포항시 남구 동해면 도구리 670,35.987924,129.441118
장기초등학교,경상북도 포항시 남구 장기면 마현리 306-2,35.8966545,129.4944042
양포초등학교,경상북도 포항시 남구 장기면 양포리 487-18,35.8761451,129.5131682
신광초등학교,경상북도 포항시 북구 신광면 토성리 483,36.1291575,129.262243
청하초등학교,경상북도 포항시 북구 청하면 덕성리 327,36.1985467,129.3377757
월포초등학교,경상북도 포항시 북구 청하면 월포리 649-17,36.2028951,129.3678625
장기초등학교모포분교장,경상북도 포항시 남구 장기면 모포리 95,35.9345691,129.5232526
죽장초등학교,경상북도 포항시 북구 죽장면 입암리 730-1,36.1595594,129.0913254
죽장초등학교상옥분교장,경상북도 포항시 북구 죽장면 상옥리 748-1,36.2463586,129.2139076
계림초등학교,경상북도 경주시 북부동 9,35.8493161,129.2127197
황남초등학교,경상북도 경주시 황남동 173,35.8339419,129.2120257
화랑초등학교,경상북도 경주시 구황동 862,35.8421535,129.2297957
동방초등학교,경상북도 경주시 동방동 151,35.8038232,129.2620089
덕촌초등학교,경상북도 구미시 옥성면 덕촌리 449,36.2626567,128.2541037
장천초등학교,경상북도 구미시 장천면 하장리 503-1,36.1303853,128.4948333
산동초등학교,경상북도 구미시 산동면 인덕리 612,36.1669581,128.4465007
진성초등학교,경상남도 진주시 진성면 상촌리 541-2,35.1699654,128.2246676
반성초등학교,경상남도 진주시 일반성면 개암리 805-3,35.1694906,128.2856642
이반성초등학교,경상남도 진주시 이반성면 하곡리 977,35.1733561,128.3288013
사봉초등학교,경상남도 진주시 사봉면 사곡리 993-1,35.1888823,128.2692505
지수초등학교,경상남도 진주시 지수면 압사리 1065-1,35.2329873,128.2524993
대곡초등학교,경상남도 진주시 대곡면 와룡리 591,35.2578687,128.1770874
금호초등학교,경상남도 진주시 금산면 장사리 961,35.2187643,128.1435644
금산초등학교,경상남도 진주시 금산면 중천리 251,35.2149866,128.1441179
집현초등학교,경상남도 진주시 집현면 지내리 125,35.241792,128.092765
미천초등학교,경상남도 진주시 미천면 안간리 797-5,35.3189488,128.0879272
명석초등학교,경상남도 진주시 명석면 우수리 109,35.2181769,128.0402204
한평초등학교,경상남도 진주시 대평면 대평리 509,35.2348183,127.9597503
수곡초등학교,경상남도 진주시 수곡면 대천리 98-1,35.2009574,127.9320362
충렬초등학교,경상남도 통영시 명정동 173,34.8471996,128.4162414
두룡초등학교,경상남도 통영시 도천동 112-3,34.8378662,128.4118536
남포초등학교,경상남도 통영시 도남동 187,34.8244327,128.4325152
한려초등학교,경상남도 통영시 도남동 483-1,34.8276276,128.4216853
인평초등학교,경상남도 통영시 인평동 333-2,34.8422049,128.3948287
통영초등학교,경상남도 통영시 무전동 1054-3,34.8628029,128.4244356
진남초등학교,경상남도 통영시 미수동 264-2,34.8324209,128.4093009
유영초등학교,경상남도 통영시 북신동 106-2,34.8513374,128.4266292
충무초등학교,경상남도 통영시 정량동 232,34.84798,128.4302641
산양초등학교,경상남도 통영시 산양읍 남평리 857,34.8015884,128.3906561
덕계초등학교,경상남도 양산시 덕계동 718-4,35.3756134,129.1532251
천성초등학교,경상남도 양산시 평산동 352,35.3792076,129.1444482
신명초등학교,경상남도 양산시 평산동 570-49,35.388521,129.141972
평산초등학교,경상남도 양산시 평산동 40-3,35.3864412,129.1533974
성산초등학교,경상남도 양산시 물금읍 범어리 2712-6,35.3303734,129.01771
물금초등학교,경상남도 양산시 물금읍 가촌리 469-1,35.316953,128.9903012
범어초등학교,경상남도 양산시 물금읍 범어리 718-3,35.3312709,129.0053935
오봉초등학교,경상남도 양산시 물금읍 범어리 503,35.3349026,129.0042111
서남초등학교,경상남도 양산시 물금읍 범어리 554,35.3284756,128.9988013
황산초등학교,경상남도 양산시 물금읍 범어리 2677-2,35.3311555,129.0092284
동산초등학교,경상남도 양산시 동면 금산리 758-6,35.3039829,129.0257264
영천초등학교,경상남도 양산시 동면 여락리 30,35.3112625,129.1103554
영주초등학교,경상북도 영주시 영주동 26,36.8287996,128.6244296
화제초등학교,경상남도 양산시 원동면 화제리 1296-2,35.3510019,128.9787474
원동초등학교,경상남도 양산시 원동면 원리 951,35.3643048,128.9221287
좌삼초등학교,경상남도 양산시 상북면 좌삼리 493,35.4404863,129.0436708
상북초등학교,경상남도 양산시 상북면 석계리 122,35.416166,129.0600994
소토초등학교,경상남도 양산시 상북면 소토리 651,35.3794508,129.0528665
용연초등학교,경상남도 양산시 하북면 백록리 1245-1,35.4494081,129.0748344
하북초등학교,경상남도 양산시 하북면 순지리 702,35.489915,129.0877775
원동초등학교이천분교장,경상남도 양산시 원동면 선리 1424,35.4871107,128.9854139
율천초등학교,경상남도 고성군 고성읍 죽계리 735-1,34.9923201,128.3278644
대성초등학교,경상남도 고성군 고성읍 성내리 2-9,34.975901,128.3224212
한림초등학교,제주특별자치도 제주시 한림읍 한림리 1383,33.4112203,126.2612256
동남초등학교,제주특별자치도 서귀포시 성산읍 고성리 1128-1,33.4487685,126.9138006
수산초등학교,제주특별자치도 서귀포시 성산읍 수산리 580,33.4473708,126.8857943
시흥초등학교,제주특별자치도 서귀포시 성산읍 시흥리 1214-4,33.4791282,126.8958741
성산초등학교,제주특별자치도 서귀포시 성산읍 성산리 333,33.4679833,126.9317372
신산초등학교,제주특별자치도 서귀포시 성산읍 신산리 963,33.3817985,126.8756438
풍천초등학교,제주특별자치도 서귀포시 성산읍 신천리 603,33.3488218,126.8501573
온평초등학교,제주특별자치도 서귀포시 성산읍 온평리 1577,33.4080862,126.8970156
보성초등학교,제주특별자치도 서귀포시 대정읍 보성리 1629-1,33.2495623,126.2761054
대정서초등학교,제주특별자치도 서귀포시 대정읍 동일리 2659-2,33.2318912,126.2389191
무릉초등학교,제주특별자치도 서귀포시 대정읍 무릉리 2802,33.2719834,126.2016148
대정초등학교,제주특별자치도 서귀포시 대정읍 상모리 3864,33.2250085,126.2554541
남원초등학교,제주특별자치도 서귀포시 남원읍 남원리 1344,33.2788535,126.7157299
흥산초등학교,제주특별자치도 서귀포시 남원읍 신흥리 174-1,33.2999207,126.7652497
의귀초등학교,제주특별자치도 서귀포시 남원읍 의귀리 1483-3,33.3107338,126.7143754
신례초등학교,제주특별자치도 서귀포시 남원읍 신례리 822-1,33.2841572,126.6321472
영일초등학교,경상북도 영주시 영주동 486,36.8260147,128.6145493
위미초등학교,제주특별자치도 서귀포시 남원읍 위미리 3235,33.2739653,126.6535855
태흥초등학교,제주특별자치도 서귀포시 남원읍 태흥리 970-3,33.2861922,126.7430815
왕곡초등학교,전라남도 나주시 왕곡면 월천리 206,34.9629507,126.6549267
공산초등학교,전라남도 나주시 공산면 금곡리 780,34.9413938,126.6127842
동강초등학교,전라남도 나주시 동강면 인동리 355,34.9382077,126.5650367
도개초등학교,경상북도 구미시 도개면 궁기리 839-5,36.3003513,128.3313009
해평초등학교,경상북도 구미시 해평면 월호리 395,36.2031015,128.3910954
영주남부초등학교,경상북도 영주시 휴천동 642-180,36.8078011,128.6170744
영주서부초등학교,경상북도 영주시 가흥동 507-6,36.8319027,128.611512
고흥동초등학교,전라남도 고흥군 고흥읍 호형리 1287,34.6085473,127.2901494
영주중앙초등학교,경상북도 영주시 하망동 316-18,36.8264461,128.6278802
영주동부초등학교,경상북도 영주시 휴천동 714,36.8207432,128.6314336
남산초등학교,경상북도 영주시 휴천동 680,36.8162953,128.6264978
풍기북부초등학교,경상북도 영주시 풍기읍 교촌리 104-1,36.8796391,128.5251895
풍기초등학교,경상북도 영주시 풍기읍 성내리 22-1,36.8716494,128.5240298
순흥초등학교,경상북도 영주시 순흥면 읍내리 378-2,36.9120052,128.5765923
부석초등학교,경상북도 영주시 부석면 소천리 365,36.9808525,128.654902
옥대초등학교,경상북도 영주시 단산면 옥대리 200,36.9506934,128.6195069
이산초등학교,경상북도 영주시 이산면 석포리 1036,36.8301146,128.6814803
장수초등학교,경상북도 영주시 장수면 반구리 981,36.7759475,128.5766785
안정초등학교,경상북도 영주시 안정면 신전리 111-1,36.8453828,128.5550393
문수초등학교,경상북도 영주시 문수면 적동리 350-1,36.7741198,128.6331641
봉현초등학교,경상북도 영주시 봉현면 대촌리 170,36.8474473,128.5254175
영천중앙초등학교,경상북도 영천시 문내동 25-1,35.9719643,128.9318358
영천초등학교,경상북도 영천시 금노동 504-1,35.9614198,128.9321647
곡성중앙초등학교,전라남도 곡성군 곡성읍 읍내리 703,35.284337,127.2913048
고달초등학교,전라남도 곡성군 고달면 목동리 730,35.296475,127.3417757
죽곡초등학교,전라남도 곡성군 죽곡면 태평리 614,35.1534329,127.3178918
아라초등학교,경상남도 함안군 가야읍 말산리 257-1,35.2711222,128.4092718
함안초등학교,경상남도 함안군 함안면 봉성리 1214,35.2409556,128.421206
군북초등학교,경상남도 함안군 군북면 덕대리 17,35.2579322,128.3467169
월촌초등학교,경상남도 함안군 군북면 월촌리 1214,35.291465,128.3033334
법수초등학교,경상남도 함안군 법수면 윤외리 200,35.3175868,128.3800432
산인초등학교,경상남도 함안군 산인면 내인리 204,35.2898983,128.4326303
문암초등학교,경상남도 함안군 산인면 모곡리 510,35.2728507,128.4575348
대산초등학교,경상남도 함안군 대산면 구혜리 229,35.351389,128.4311216
유원초등학교,경상남도 함안군 칠원면 유원리 374,35.2978186,128.4966208
칠원초등학교,경상남도 함안군 칠원면 구성리 730,35.3066796,128.5201084
예곡초등학교,경상남도 함안군 칠원면 예곡리 433,35.2767179,128.5322277
호암초등학교,경상남도 함안군 칠원읍 오곡리 97,35.2744968,128.5206495
칠서초등학교,경상남도 함안군 칠서면 청계리 729,35.3324529,128.4982852
외암초등학교,경상남도 함안군 여항면 외암리 726-1,35.2090706,128.4343524
칠서초등학교이령분교장,경상남도 함안군 칠북면 이령리 231-9,35.3661697,128.5391873
칠서초등학교이룡분교장,경상남도 함안군 칠서면 이룡리 900,35.3874594,128.5063955
명덕초등학교,경상남도 창녕군 창녕읍 교리 254,35.543567,128.4969067
창녕초등학교,경상남도 창녕군 창녕읍 말흘리 210,35.5365817,128.502237
남지초등학교,경상남도 창녕군 남지읍 남지리 723,35.3891738,128.4715511
동포초등학교,경상남도 창녕군 남지읍 남지리 598-2,35.3906662,128.4789924
유어초등학교,경상남도 창녕군 유어면 부곡리 481,35.5088741,128.4109906
대지초등학교,경상남도 창녕군 대지면 석리 277,35.5567226,128.4635541
장천초등학교,경상남도 창녕군 이방면 장천리 436,35.5997408,128.37483
구봉초등학교,경상남도 김해시 구산동 199,35.2404336,128.8732456
재릉초등학교,제주특별자치도 제주시 한림읍 협재리 2660,33.3878828,126.2381205
대흘초등학교,제주특별자치도 제주시 조천읍 대흘리 1672-1,33.4994924,126.6580038
신촌초등학교,제주특별자치도 제주시 조천읍 신촌리 1828,33.5343081,126.6192506
조천초등학교,제주특별자치도 제주시 조천읍 조천리 3140,33.535442,126.6338169
함덕초등학교,제주특별자치도 제주시 조천읍 함덕리 287-2,33.5384767,126.6720487
북촌초등학교,제주특별자치도 제주시 조천읍 북촌리 1212,33.5476268,126.6916818
김녕초등학교,제주특별자치도 제주시 구좌읍 김녕리 1656,33.5552251,126.75064
세화초등학교,제주특별자치도 제주시 구좌읍 세화리 1391-1,33.5224606,126.8587074
평대초등학교,제주특별자치도 제주시 구좌읍 평대리 650,33.5292302,126.8405223
구좌중앙초등학교,제주특별자치도 제주시 구좌읍 월정리 100,33.551558,126.7980073
종달초등학교,제주특별자치도 제주시 구좌읍 종달리 1918,33.4924167,126.8972645
하도초등학교,제주특별자치도 제주시 구좌읍 하도리 2315,33.5172651,126.8785134
송당초등학교,제주특별자치도 제주시 구좌읍 송당리 1366,33.4708765,126.7808089
한동초등학교,제주특별자치도 제주시 구좌읍 한동리 1168,33.5386022,126.8288641
애월초등학교더럭분교장,제주특별자치도 제주시 애월읍 하가리 1580-1,33.4534432,126.3453821
조천초등학교교래분교장,제주특별자치도 제주시 조천읍 교래리 564,33.4363639,126.6784893
함덕초등학교선흘분교장,제주특별자치도 제주시 조천읍 선흘리 1019,33.514848,126.7047419
김녕초등학교동복분교장,제주특별자치도 제주시 구좌읍 동복리 1367,33.5522311,126.7134687
고산초등학교,제주특별자치도 제주시 한경면 고산리 2684-1,33.3042852,126.1771664
김해활천초등학교,경상남도 김해시 지내동 297-5,35.2317314,128.9182125
반남초등학교,전라남도 나주시 반남면 신촌리 129,34.9107808,126.658644
다시초등학교,전라남도 나주시 다시면 월태리 521,35.0175501,126.6398753
문평초등학교,전라남도 나주시 문평면 동원리 719,35.0586683,126.6038116
골약초등학교,전라남도 광양시 황길동 827,34.9106317,127.6603921
성황초등학교,전라남도 광양시 성황동 342,34.940269,127.6826688
광양마동초등학교,전라남도 광양시 마동 1028,34.9555838,127.6891907
광양가야초등학교,전라남도 광양시 광영동 250,34.9669281,127.7128567
광영초등학교,전라남도 광양시 광영동 75,34.9634295,127.7202166
광양중앙초등학교,전라남도 광양시 중동 1347-1,34.9454365,127.6940788
광양중마초등학교,전라남도 광양시 중동 1511,34.9475438,127.6861334
광양중진초등학교,전라남도 광양시 중동 1671,34.9329647,127.6923077
광양백운초등학교,전라남도 광양시 중동 1656,34.9372634,127.6917992
광양중동초등학교,전라남도 광양시 중동 1685,34.9332983,127.6959407
태인초등학교,전라남도 광양시 태인동 1437,34.9457954,127.7442964
광양제철초등학교,전라남도 광양시 금호동 681,34.9455655,127.7296266
광양제철남초등학교,전라남도 광양시 금호동 624-11,34.9346828,127.7207735
광양용강초등학교,전라남도 광양시 광양읍 용강리 608,34.9762082,127.6103126
광양덕례초등학교,전라남도 광양시 광양읍 덕례리 448,34.9686917,127.5705956
세풍초등학교,전라남도 광양시 광양읍 세풍리 210,34.9439063,127.5823729
광양북초등학교,전라남도 광양시 광양읍 목성리 494-4,34.9765955,127.5936416
광양서초등학교,전라남도 광양시 광양읍 인서리 120,34.9713962,127.5836138
산이서초등학교금호분교장,전라남도 해남군 산이면 금호리 539,34.6910732,126.3629288
합도초등학교,충청남도 당진시 합덕읍 운산리 685-28,36.8101895,126.7539424
어란진초등학교어불분교장,전라남도 해남군 송지면 어란리 1812,34.3378484,126.4724149
영암초등학교,전라남도 영암군 영암읍 회문리 186,34.7965297,126.6875624
석곡초등학교,전라남도 곡성군 석곡면 석곡리 8,35.1352507,127.2534552
삼기초등학교,전라남도 곡성군 삼기면 원등리 832,35.2368445,127.2086461
옥과초등학교,전라남도 곡성군 옥과면 죽림리 90,35.2766898,127.1427531
오산초등학교,전라남도 곡성군 오산면 봉동리 500,35.2390356,127.1210694
입면초등학교,전라남도 곡성군 입면 송전리 573,35.3072691,127.1852659
구례중앙초등학교,전라남도 구례군 구례읍 봉남리 32-1,35.2044256,127.4652365
구례북초등학교,전라남도 구례군 구례읍 봉동리 489,35.2102633,127.4603547
서정초등학교,충청남도 당진시 신평면 거산리 40,36.8800888,126.754959
문척초등학교,전라남도 구례군 문척면 월전리 286-1,35.1917069,127.4904878
용방초등학교,전라남도 구례군 용방면 용정리 199-2,35.2507575,127.4331866
중동초등학교,전라남도 구례군 산동면 관산리 631,35.3189423,127.4653986
원촌초등학교,전라남도 구례군 산동면 원촌리 214,35.3168312,127.4385157
광의초등학교,전라남도 구례군 광의면 연파리 271,35.259142,127.4451844
청천초등학교,전라남도 구례군 마산면 마산리 498-3,35.2213218,127.486931
토지초등학교,전라남도 구례군 토지면 구산리 145-1,35.1972906,127.5270988
간문초등학교,전라남도 구례군 간전면 간문리 220-1,35.1773727,127.5422001
토지초등학교연곡분교장,전라남도 구례군 토지면 내서리 12,35.2469913,127.5905438
녹동초등학교,전라남도 고흥군 도양읍 봉암리 1553-1,34.5300597,127.1394662
점암초등학교,전라남도 고흥군 점암면 모룡리 817,34.6517405,127.3818657
과역초등학교,전라남도 고흥군 과역면 과역리 458,34.6792371,127.3575558
남양초등학교,전라남도 고흥군 남양면 대곡리 520,34.7284602,127.3544463
영광중앙초등학교월송분교장,전라남도 영광군 영광읍 덕호리 128,35.3063698,126.4854063
영광중앙초등학교,전라남도 영광군 영광읍 백학리 253,35.2792051,126.5061778
영광초등학교,전라남도 영광군 영광읍 무령리 306,35.278494,126.5140537
신광초등학교,제주특별자치도 제주시 연동 1996-5,33.4917137,126.4843069
하례초등학교,제주특별자치도 서귀포시 남원읍 하례리 326,33.2644409,126.6308696
청량중학교,서울특별시 동대문구 청량리동 14,37.5877215,127.0513845
토산초등학교,제주특별자치도 서귀포시 표선면 토산리 515,33.3121074,126.7777876
성읍초등학교,제주특별자치도 서귀포시 표선면 1002,33.3836035,126.7981213
한마음초등학교,제주특별자치도 서귀포시 표선면 하천리 1794-1,33.3519002,126.8150955
가마초등학교,제주특별자치도 서귀포시 표선면 세화리 1538-3,33.3053859,126.7996074
표선초등학교,제주특별자치도 서귀포시 표선면 표선리 456,33.3294782,126.835186
창천초등학교,제주특별자치도 서귀포시 안덕면 창천리 473,33.2633051,126.3693564
덕수초등학교,제주특별자치도 서귀포시 안덕면 덕수리 2379-3,33.2516395,126.3045495
사계초등학교,제주특별자치도 서귀포시 안덕면 사계리 1731-2,33.2332443,126.2997115
전동중학교,서울특별시 동대문구 휘경동 49-295,37.5853643,127.0711298
서광초등학교,제주특별자치도 서귀포시 안덕면 서광리 337-1,33.288305,126.3263522
안덕초등학교,제주특별자치도 서귀포시 안덕면 화순리 1290,33.2504061,126.335987
가파초등학교,제주특별자치도 서귀포시 대정읍 가파리 464,33.1691708,126.270443
숭인중학교,서울특별시 동대문구 답십리동 463-1,37.5737834,127.0440889
장평중학교,서울특별시 동대문구 장안동 352,37.5662835,127.0705294
전일중학교,서울특별시 동대문구 전농동 60-1,37.5815753,127.0584078
전농중학교,서울특별시 동대문구 전농동 58-1,37.5812656,127.0597057
동대문중학교,서울특별시 동대문구 답십리동 420-1,37.5744331,127.0520786
성일중학교,서울특별시 동대문구 제기동 271-41,37.5812877,127.0338291
김해구지초등학교,경상남도 김해시 구산동 1053,35.2526223,128.8691448
우암초등학교,경상남도 김해시 내동 1072,35.243116,128.8669103
김해내동초등학교,경상남도 김해시 내동 168,35.2424207,128.858945
경운초등학교,경상남도 김해시 내동 1098,35.2381818,128.8606152
삼방초등학교,경상남도 김해시 삼방동 675,35.2487874,128.9077183
영운초등학교,경상남도 김해시 삼방동 733,35.2545618,128.9069323
김해삼성초등학교,경상남도 김해시 삼정동 635-1,35.2336158,128.9002062
김해대곡초등학교,경상남도 김해시 어방동 627,35.2440302,128.898689
김해외동초등학교,경상남도 김해시 외동 1218,35.2324023,128.8575933
김해가야초등학교,경상남도 김해시 외동 830,35.2363801,128.8509812
금산초등학교,경상남도 김해시 진영읍 좌곤리 356-1,35.2919187,128.7085225
진영대창초등학교,경상남도 김해시 진영읍 여래리 384-9,35.3015397,128.7385831
진영금병초등학교,경상남도 김해시 진영읍 진영리 1611-5,35.3097772,128.7344516
진영대흥초등학교,경상남도 김해시 진영읍 진영리 270,35.303462,128.7248939
금동초등학교,경상남도 김해시 상동면 대감리 656-2,35.3089239,128.9300868
이작초등학교,경상남도 김해시 생림면 생철리 1104,35.3610413,128.8374158
생림초등학교,경상남도 김해시 생림면 봉림리 686-2,35.3317978,128.8475763
장유초등학교,경상남도 김해시 무계동 132,35.2045472,128.8113769
계동초등학교,경상남도 김해시 대청동 333-1,35.1846582,128.7948332
월산초등학교,경상남도 김해시 부곡동 1166-1,35.2011623,128.8050377
덕정초등학교,경상남도 김해시 관동동 452-4,35.1777755,128.7982738
고성초등학교,경상남도 고성군 고성읍 서외리 90,34.9764329,128.3190281
회화초등학교,경상남도 고성군 회화면 배둔리 347-11,35.0621761,128.3737971
서창초등학교,전라남도 영암군 삼호읍 서창리 475,34.7282274,126.5324345
삼호서초등학교,전라남도 영암군 삼호읍 용당리 2178-1,34.7457715,126.3785922
용당초등학교,전라남도 영암군 삼호읍 용당리 378,34.7618923,126.3997547
