name,address,lat,lng
녹전중학교,강원도 영월군 중동면 녹전리 801-3,37.1441523,128.6779149
옥동중학교,강원도 영월군 김삿갓면 옥동리 402,37.1281656,128.5705668
마차중학교,강원도 영월군 북면 마차리 1347,37.2558833,128.4517893
상동중학교,강원도 영월군 상동읍 천평리 177-1,37.1250207,128.8219498
평창중학교,강원도 평창군 평창읍 중리 350,37.3691202,128.3988211
미탄중학교,강원도 평창군 미탄면 창리 611,37.3419379,128.4974212
대화중학교,강원도 평창군 대화면 대화리 476,37.4925699,128.4596506
봉평중학교,강원도 평창군 봉평면 창동리 332,37.6179041,128.3813671
음성중학교,충청북도 음성군 음성읍 읍내리 274-3,36.9354892,127.6956432
산북중학교,경상북도 문경시 산북면 대상리 97-3,36.6543102,128.2584687
문경서중학교,경상북도 문경시 문경읍 상리 351,36.7392575,128.1056943
대아중학교,경상남도 진주시 이현동 316,35.1897921,128.0581594
진주동명중학교,경상남도 진주시 초전동 515,35.2026006,128.1198465
삼현여자중학교,경상남도 진주시 상평동 218-1,35.1781615,128.1115977
경해여자중학교,경상남도 진주시 평거동 695-7,35.1650813,128.0425534
금곡중학교,경상남도 진주시 금곡면 동례리 400,35.1038323,128.1819503
반성중학교,경상남도 진주시 사봉면 무촌리 107,35.1749412,128.2753962
지수중학교,경상남도 진주시 지수면 승산리 511-1,35.229324,128.2677258
대곡중학교,경상남도 진주시 대곡면 광석리 330,35.2634034,128.1669889
명석중학교,경상남도 진주시 명석면 관지리 256,35.2169051,128.0424715
진서중학교,경상남도 진주시 수곡면 대천리 226-1,35.197737,127.9281183
진주동중학교,경상남도 진주시 금산면 중천리 281-3,35.2162141,128.1428459
통영중학교,경상남도 통영시 봉평동 196,34.8286813,128.4167711
충무중학교,경상남도 통영시 인평동 386-3,34.8406398,128.3965378
통영여자중학교,경상남도 통영시 도천동 341-1,34.8408107,128.4101845
충무여자중학교,경상남도 통영시 인평동 385,34.8414365,128.395492
통영중앙중학교,경상남도 통영시 무전동 1054-4,34.8618565,128.4244088
동원중학교,경상남도 통영시 광도면 죽림리 산369-1,34.869812,128.4126478
산양중학교,경상남도 통영시 산양읍 남평리 862-1,34.802285,128.3926922
도산중학교,경상남도 통영시 도산면 법송리 1042,34.9039154,128.3617722
충렬여자중학교,경상남도 통영시 용남면 장평리 203-1,34.887103,128.4647772
욕지중학교,경상남도 통영시 욕지면 동항리 809-2,34.6357097,128.260242
한산중학교,경상남도 통영시 한산면 하소리 36-2,34.7682661,128.5068803
봉명중학교,경상남도 김해시 외동 470,35.2273426,128.8623907
포항항도중학교,경상북도 포항시 북구 죽도동 655-9,36.0186896,129.355871
창포중학교,경상북도 포항시 북구 창포동 647,36.0658163,129.3687923
장흥중학교,경상북도 포항시 북구 장성동 1372-1,36.0856229,129.3868577
동지중학교,경상북도 포항시 북구 용흥동 산125-3,36.0365713,129.3444168
포항영신중학교,경상북도 포항시 북구 우현동 산63-13,36.0596182,129.3510002
대동중학교,경상북도 포항시 북구 우현동 201-6,36.0585059,129.3583782
동지여자중학교,경상북도 포항시 북구 용흥동 511,36.0379099,129.3454233
용하중학교,강원도 양구군 남면 용하리 64,38.1116516,128.0385569
포항제철중학교,경상북도 포항시 남구 지곡동 52,36.0203061,129.3264937
구룡포중학교,경상북도 포항시 남구 구룡포읍 구룡포리 199-30,35.991694,129.5655821
유강중학교,경상북도 포항시 남구 연일읍 유강리 143-5,36.0087104,129.3180682
신흥중학교,경상북도 포항시 남구 오천읍 세계리 700-3,35.9646914,129.4223841
영일중학교,경상북도 포항시 남구 연일읍 동문리 47-1,35.9955298,129.3534695
오천중학교,경상북도 포항시 남구 오천읍 용덕리 267,35.9692123,129.4127922
흥해중학교,경상북도 포항시 북구 흥해읍 옥성리 168-1,36.1088054,129.3413908
대보중학교,경상북도 포항시 남구 호미곶면 대보리 214,36.075265,129.5675808
대송중학교,경상북도 포항시 남구 대송면 남성리 83-5,35.9776222,129.3596605
기계중학교,경상북도 포항시 북구 기계면 현내리 1089,36.0775177,129.1962904
송라중학교,경상북도 포항시 북구 송라면 광천리 184,36.2279678,129.3547085
신광중학교,경상북도 포항시 북구 신광면 토성리 344,36.1303642,129.2639672
포항동해중학교,경상북도 포항시 남구 동해면 도구리 621,35.9897262,129.4395316
장기중학교,경상북도 포항시 남구 장기면 임중리 331-2,35.891631,129.492622
청하중학교,경상북도 포항시 북구 청하면 덕성리 384-1,36.1940938,129.3348212
소천중학교,경상북도 봉화군 소천면 현동리 701-10,36.9427728,129.0014609
석포중학교,경상북도 봉화군 석포면 석포리 356-2,37.0515102,129.0675221
춘양중학교서벽분교장,경상북도 봉화군 춘양면 서벽리 473-1,37.0113092,128.8277507
평해중학교,경상북도 울진군 평해읍 월송리 508-3,36.7431326,129.463337
평해여자중학교,경상북도 울진군 평해읍 평해리 413,36.72856,129.4442084
울진중학교,경상북도 울진군 울진읍 연지리 822,36.9947414,129.4051086
죽변중학교,경상북도 울진군 죽변면 죽변리 215,37.0652882,129.4211021
후포중학교,경상북도 울진군 후포면 후포리 1015,36.6806293,129.4456603
온정중학교,경상북도 울진군 온정면 소태리 799-1,36.726306,129.3467609
기성중학교,경상북도 울진군 기성면 기성리 288,36.7994682,129.4571813
매화중학교,경상북도 울진군 원남면 매화리 1141,36.9118245,129.3809269
부구중학교,경상북도 울진군 북면 부구리 863-7,37.098964,129.3565856
울릉중학교,경상북도 울릉군 울릉읍 도동리 223-8,37.4881682,130.9012021
우산중학교,경상북도 울릉군 울릉읍 저동리 452,37.4982555,130.9047465
울릉서중학교,경상북도 울릉군 서면 남서리 30-3,37.4736145,130.8342539
울릉북중학교,경상북도 울릉군 북면 천부리 713,37.5426974,130.8713996
구암중학교,경상남도 창원시 마산회원구 구암동 1334,35.2567602,128.5977818
양덕중학교,경상남도 창원시 마산회원구 합성동 17-5,35.2425677,128.5949744
마산동중학교,경상남도 창원시 마산회원구 회원동 376-1,35.2211004,128.5678387
마산서중학교,경상남도 창원시 마산합포구 월영동 534-20,35.1779983,128.5573056
마산중학교,경상남도 창원시 마산합포구 자산동 274,35.2031906,128.5617283
해운중학교,경상남도 창원시 마산합포구 해운동 51,35.177173,128.5652974
반송중학교,경상남도 창원시 성산구 반림동 19,35.2356188,128.6753353
진해중학교,경상남도 창원시 진해구 여좌동 63,35.1601946,128.664414
음성여자중학교,충청북도 음성군 음성읍 평곡리 830-3,36.927207,127.6990098
무극중학교,충청북도 음성군 금왕읍 무극리 23-2,36.9884737,127.5917344
한일중학교,충청북도 음성군 음성읍 읍내리 755,36.9355429,127.6850681
감곡중학교,충청북도 음성군 감곡면 오향리 890-3,37.1110921,127.6416789
대소중학교,충청북도 음성군 대소면 삼정리 613-7,36.9632002,127.4899453
삼성중학교,충청북도 음성군 삼성면 덕정리 431-1,37.0247289,127.5000214
매괴여자중학교,충청북도 음성군 감곡면 왕장리 510-1,37.1198753,127.6407036
생극중학교,충청북도 음성군 생극면 신양리 492,37.0367054,127.6056482
단양중학교,충청북도 단양군 단양읍 도전리 222,36.9800211,128.366725
매포중학교,충청북도 단양군 매포읍 평동리 118,37.0295872,128.3057632
단성중학교,충청북도 단양군 단성면 상방리 79-1,36.9352648,128.3217518
영춘중학교,충청북도 단양군 영춘면 상리 496-1,37.0831419,128.4840191
천안중학교,충청남도 천안시 동남구 원성동 191,36.8107951,127.1571549
천안여자중학교,충청남도 천안시 동남구 원성동 559-1,36.8021415,127.1573363
천안북중학교,충청남도 천안시 동남구 성황동 4,36.8148202,127.1540008
천안동중학교,충청남도 천안시 동남구 삼룡동 231,36.7891007,127.1666346
대암중학교,강원도 양구군 동면 지석리 470,38.1828689,128.0362939
천안용곡중학교,충청남도 천안시 동남구 용곡동 476-9,36.7894285,127.1331625
천안새샘중학교,충청남도 천안시 동남구 신방동 1601,36.7760718,127.1377464
천안가온중학교,충청남도 천안시 동남구 청당동 482,36.7875217,127.1556407
천안신방중학교,충청남도 천안시 동남구 신방동 62-45,36.7902188,127.1263185
천안쌍용중학교,충청남도 천안시 서북구 쌍용동 1927,36.8036546,127.1205037
천안성정중학교,충청남도 천안시 서북구 성정동 1152,36.8296358,127.1362562
태안여자중학교,충청남도 태안군 태안읍 동문리 350-3,36.7517194,126.3063015
조도중학교,전라남도 진도군 조도면 창유리 1031,34.3126619,126.0424211
사량중학교,경상남도 통영시 사량면 금평리 107,34.8445961,128.2199729
삼천포제일중학교,경상남도 사천시 용강동 505-1,34.9484369,128.0859357
장성남중학교,전라남도 장성군 남면 분향리 335,35.2438131,126.8114359
완도중학교,전라남도 완도군 완도읍 군내리 943,34.3088864,126.7510838
완도여자중학교,전라남도 완도군 완도읍 군내리 1096,34.3135564,126.7422389
군외중학교,전라남도 완도군 군외면 원동리 1,34.3897994,126.6536478
청산중학교,전라남도 완도군 청산면 도청리 220,34.1816824,126.8641905
소안중학교,전라남도 완도군 소안면 비자리 874,34.1731758,126.6555646
노화중학교,전라남도 완도군 노화읍 이포리 345,34.1835905,126.5734573
완도보길중학교,전라남도 완도군 보길면 부황리 11-3,34.1690989,126.5637663
완도신지중학교,전라남도 완도군 신지면 대곡리 781-1,34.3366587,126.8284406
고금중학교,전라남도 완도군 고금면 농상리 365,34.3937345,126.8016341
약산중학교,전라남도 완도군 약산면 장용리 850,34.3928641,126.8984718
금일중학교,전라남도 완도군 금일읍 신구리 830,34.3517541,127.032504
금당중학교,전라남도 완도군 금당면 육산리 201,34.4407232,127.0599416
노화중학교넙도분교장,전라남도 완도군 노화읍 내리 488-1,34.188335,126.5040375
금일중학교생일분교장,전라남도 완도군 생일면 유서리 626,34.3349519,126.9902696
진도중학교,전라남도 진도군 진도읍 교동리 580-1,34.4831975,126.2585485
고성중학교,전라남도 진도군 고군면 고성리 144,34.4998037,126.323884
진도군내중학교,전라남도 진도군 군내면 둔전리 369,34.5383351,126.2955918
석교중학교,전라남도 진도군 임회면 석교리 366,34.4089537,126.1959963
의신중학교,전라남도 진도군 의신면 돈지리 660-2,34.440042,126.2791801
진도지산중학교,전라남도 진도군 지산면 인지리 194-7,34.4190908,126.1708595
기계중학교기북분교장,경상북도 포항시 북구 기북면 용기리 765-20,36.1309154,129.1669337
축산중학교,경상북도 영덕군 축산면 도곡리 450,36.5132171,129.4062536
남정중학교,경상북도 영덕군 남정면 장사리 410-1,36.2836964,129.3706053
병곡중학교,경상북도 영덕군 병곡면 병곡리 283,36.6042776,129.4106945
지품중학교,경상북도 영덕군 지품면 신안리 92-4,36.4506332,129.2826193
청도중학교,경상북도 청도군 청도읍 고수리 840-2,35.6410474,128.7481108
모계중학교,경상북도 청도군 화양읍 범곡리 117,35.6493433,128.7353769
풍각중학교,경상북도 청도군 풍각면 송서리 553-6,35.6408041,128.6205562
매전중학교,경상북도 청도군 매전면 동산리 445-4,35.6679468,128.8524808
금천중학교,경상북도 청도군 금천면 동곡리 1035,35.6879076,128.8947636
이서중학교,경상북도 청도군 이서면 서원리 331-3,35.6622552,128.6696642
풍각중학교각북분교장,경상북도 청도군 각북면 남산리 248,35.6906042,128.5878567
고령중학교,경상북도 고령군 고령읍 쾌빈리 106-5,35.7410769,128.2710126
성산중학교,경상북도 고령군 성산면 어곡리 122-1,35.7518849,128.3619611
쌍림중학교,경상북도 고령군 쌍림면 귀원리 31,35.6845846,128.2435023
다산중학교,경상북도 고령군 다산면 월성리 210,35.8164555,128.4266867
우곡중학교,경상북도 고령군 우곡면 월오리 414,35.6458209,128.3564848
고령중학교개진분교장,경상북도 고령군 개진면 오사리 42,35.7178018,128.3693621
성주중학교,경상북도 성주군 성주읍 예산리 640,35.928682,128.2830168
성주여자중학교,경상북도 성주군 성주읍 경산리 463,35.9166278,128.2820473
초전중학교,경상북도 성주군 초전면 대장리 610-1,35.9760947,128.2640969
벽진중학교,경상북도 성주군 벽진면 수촌리 63-1,35.9604495,128.2118526
용암중학교,경상북도 성주군 용암면 본리리 724,35.8410749,128.3142477
성주중학교가천분교장,경상북도 성주군 가천면 창천리 861,35.8860605,128.1599161
정곡중학교,경상남도 의령군 정곡면 중교리 513,35.3820834,128.3276905
지정중학교,경상남도 의령군 지정면 마산리 650-2,35.3657169,128.4144273
함안중학교,경상남도 함안군 가야읍 도항리 163-3,35.2829215,128.4039997
함안여자중학교,경상남도 함안군 가야읍 도항리 463,35.2726773,128.4025417
법수중학교,경상남도 함안군 법수면 우거리 913,35.3123975,128.3493255
호암중학교,경상남도 함안군 칠원읍 오곡리 101,35.2743931,128.5217041
함성중학교,경상남도 함안군 함안면 북촌리 1002-3,35.2413717,128.4207687
군북중학교,경상남도 함안군 군북면 덕대리 267,35.260483,128.3436615
대산중학교,경상남도 함안군 대산면 평림리 955,35.3476658,128.4387372
칠원중학교,경상남도 함안군 칠서면 무릉리 908,35.3182268,128.5073919
칠성중학교,경상남도 함안군 칠서면 용성리 22-22,35.388385,128.5026146
창녕중학교,경상남도 창녕군 창녕읍 말흘리 294,35.5350675,128.5026642
묵호여자중학교,강원도 동해시 발한동 377,37.559571,129.1025287
남지중학교,경상남도 창녕군 남지읍 마산리 894-6,35.3890129,128.468989
창녕여자중학교,경상남도 창녕군 창녕읍 말흘리 51,35.5394209,128.5051981
신창여자중학교,경상남도 창녕군 창녕읍 술정리 151,35.5378448,128.4935657
남지여자중학교,경상남도 창녕군 남지읍 마산리 894-6,35.3895819,128.468823
영산중학교,경상남도 창녕군 영산면 서리 253,35.4598196,128.523952
부곡중학교,경상남도 창녕군 부곡면 부곡리 115,35.437024,128.6075435
창녕옥야중학교,경상남도 창녕군 이방면 장천리 49,35.5995222,128.3798245
대성중학교,경상남도 창녕군 대합면 등지리 651-7,35.600592,128.4610712
성산중학교,경상남도 창녕군 성산면 정녕리 566,35.6195081,128.4724816
웅상중학교,경상남도 양산시 평산동 297-3,35.3770894,129.1444834
웅상여자중학교,경상남도 양산시 평산동 281-1,35.3759017,129.144228
안면중학교,충청남도 태안군 안면읍 승언리 60-1,36.5089256,126.3541827
창기중학교,충청남도 태안군 안면읍 창기리 1115-15,36.5773688,126.3336001
원이중학교,충청남도 태안군 원북면 마산리 510-2,36.8295211,126.2663941
만리포중학교,충청남도 태안군 소원면 신덕리 631-2,36.7655213,126.1937792
근흥중학교,충청남도 태안군 근흥면 용신리 409-6,36.7161404,126.2289023
남면중학교,충청남도 태안군 남면 달산리 1174-2,36.6734578,126.2996022
원이중학교이원분교장,충청남도 태안군 이원면 포지리 44,36.8686471,126.2812887
합덕중학교,충청남도 당진시 합덕읍 소소리 51-1,36.8142918,126.7623042
합덕여자중학교,충청남도 당진시 합덕읍 소소리 51-5,36.8136234,126.7601797
당진중학교,충청남도 당진시 채운동 319,36.8927219,126.6218957
원당중학교,충청남도 당진시 원당동 1224,36.8999504,126.6404947
호서중학교,충청남도 당진시 원당동 918,36.9004805,126.6380094
송악중학교,충청남도 당진시 송악읍 가학리 395,36.9169494,126.7029252
서야중학교,충청남도 당진시 합덕읍 합덕리 262-1,36.7920382,126.7872366
송산중학교,충청남도 당진시 송산면 도문리 169-1,36.9354095,126.6867303
고대중학교,충청남도 당진시 고대면 대촌리 657-2,36.9362237,126.5914068
면천중학교,충청남도 당진시 면천면 성상리 995-3,36.8181058,126.662856
순성중학교,충청남도 당진시 순성면 봉소리 483-1,36.8522405,126.7051006
신평중학교,충청남도 당진시 신평면 금천리 998-5,36.883216,126.7605891
석문중학교,충청남도 당진시 석문면 삼봉리 1156-9,37.0116239,126.5326217
당진중학교대호지분교장,충청남도 당진시 대호지면 조금리 27-5,36.8993838,126.5086196
전주효정중학교,전라북도 전주시 완산구 서완산동1가 227-1,35.807056,127.1327266
전주곤지중학교,전라북도 전주시 완산구 동완산동 395,35.8096031,127.143278
문산북중학교,경기도 파주시 문산읍 당동리 149,37.8621448,126.7760788
율곡중학교,경기도 파주시 법원읍 법원리 376,37.8489911,126.8815913
지명중학교,전라남도 신안군 지도읍 광정리 1271,35.0603555,126.2134058
압해중학교,전라남도 신안군 압해읍 학교리 663-5,34.8637632,126.313636
동로중학교,경상북도 문경시 동로면 적성리 617-1,36.7757245,128.3139916
마성중학교,경상북도 문경시 마성면 외어리 400,36.6950046,128.1340751
가은중학교,경상북도 문경시 가은읍 왕능리 218,36.6444952,128.071426
경산중학교,경상북도 경산시 계양동 112-3,35.8246674,128.747527
경북체육중학교,경상북도 경산시 옥곡동 466-1,35.8114757,128.7386311
장산중학교,경상북도 경산시 사정동 59,35.8187305,128.7301971
삼성현중학교,경상북도 경산시 백천동 591-2,35.8011411,128.7396476
사동중학교,경상북도 경산시 사동 660,35.8141421,128.7592719
문명중학교,경상북도 경산시 백천동 산16,35.8055374,128.7441371
경산여자중학교,경상북도 경산시 옥곡동 7,35.8173757,128.7309072
신상중학교,경상북도 경산시 진량읍 신상리 343-1,35.8749144,128.8210529
하양여자중학교,경상북도 경산시 하양읍 대학리 100,35.9307006,128.8255271
진량중학교,경상북도 경산시 진량읍 신상리 1031,35.876499,128.8107309
자인중학교,경상북도 경산시 자인면 북사리 267,35.8208098,128.8203855
용성중학교,경상북도 경산시 용성면 당리리 150-4,35.792742,128.8739092
자인여자중학교,경상북도 경산시 자인면 동부리 208,35.8159752,128.8275459
군위중학교,경상북도 군위군 군위읍 정리 248-12,36.2461358,128.5706705
효령중학교,경상북도 군위군 효령면 중구리 355,36.1548687,128.578236
부계중학교,경상북도 군위군 부계면 춘산리 496,36.0788328,128.6551927
우보중학교,경상북도 군위군 우보면 이화리 1414-24,36.1875361,128.6668908
의흥중학교,경상북도 군위군 의흥면 읍내리 210-2,36.1748028,128.7214292
의성중학교,경상북도 의성군 의성읍 도동리 649-2,36.3424823,128.7000801
명인중학교,경상북도 성주군 선남면 도성리 1111-1,35.8857909,128.3632116
김해중앙여자중학교,경상남도 김해시 동상동 715-2,35.2327269,128.888119
한얼중학교,경상남도 김해시 진영읍 여래리 479,35.3036342,128.7412771
진영여자중학교,경상남도 김해시 진영읍 진영리 275-45,35.3043214,128.7309586
진영중학교,경상남도 김해시 진영읍 진영리 1611-6,35.3089196,128.7341308
생림중학교,경상남도 김해시 생림면 생철리 316-5,35.3534652,128.8497731
관동중학교,경상남도 김해시 관동동 422-1,35.1801667,128.7927184
대청중학교,경상남도 김해시 대청동 319-2,35.1883649,128.8021437
북평여자중학교,강원도 동해시 단봉동 1-1,37.4804991,129.1236828
능동중학교,경상남도 김해시 대청동 303-5,35.1975584,128.7942834
내덕중학교,경상남도 김해시 내덕동 224-1,35.2060851,128.8168243
월산중학교,경상남도 김해시 부곡동 806-10,35.2048564,128.8031292
율하중학교,경상남도 김해시 율하동 1293,35.1747329,128.8079042
김해대동중학교,경상남도 김해시 대동면 초정리 13-13,35.2382342,128.993207
장유중학교,경상남도 김해시 신문동 580,35.1898443,128.81971
한림중학교,경상남도 김해시 한림면 장방리 346,35.3212803,128.7992889
진례중학교,경상남도 김해시 진례면 초전리 243,35.2486195,128.7557162
밀양중학교,경상남도 밀양시 삼문동 115-1,35.4837358,128.7552853
밀양여자중학교,경상남도 밀양시 삼문동 141-14,35.4832102,128.7578431
세종중학교,경상남도 밀양시 가곡동 566-1,35.4738266,128.7636886
밀성중학교,경상남도 밀양시 내이동 602-7,35.5016106,128.7513418
밀성여자중학교,경상남도 밀양시 내이동 590-4,35.5018223,128.7503872
동명중학교,경상남도 밀양시 하남읍 수산리 436-1,35.372849,128.7129907
삼랑진중학교,경상남도 밀양시 삼랑진읍 송지리 179-1,35.4018576,128.8434282
상동중학교,경상남도 밀양시 상동면 금산리 887-3,35.5535714,128.7614076
오남중학교,경기도 남양주시 오남읍 양지리 49,37.7013373,127.2053482
어람중학교,경기도 남양주시 오남읍 오남리 358-1,37.6819735,127.214715
와부중학교,경기도 남양주시 와부읍 덕소리 75-4,37.5869372,127.2197097
동해중학교,강원도 동해시 발한동 537-3,37.5435172,129.0976507
예봉중학교,경기도 남양주시 와부읍 덕소리 259,37.5952154,127.2207106
덕소중학교,경기도 남양주시 와부읍 도곡리 1036-4,37.5807179,127.226262
심석중학교,경기도 남양주시 화도읍 마석우리 215-1,37.6563543,127.3070128
광동중학교,경기도 남양주시 진접읍 장현리 585-1,37.716225,127.1754948
별내중학교,경기도 남양주시 별내면 청학리 421,37.7106974,127.1127461
퇴계원중학교,경기도 남양주시 퇴계원면 퇴계원리 283-1,37.6524413,127.1414664
수동중학교,경기도 남양주시 수동면 입석리 333-5,37.7090275,127.3248165
연세중학교,경기도 남양주시 조안면 송촌리 787,37.5684941,127.3207301
구리중학교,경기도 구리시 수택동 784,37.5894026,127.1412141
구리여자중학교,경기도 구리시 토평동 214,37.5917319,127.1510928
동구중학교,경기도 구리시 인창동 483-7,37.6123504,127.1347777
장자중학교,경기도 구리시 교문동 823,37.5859355,127.1352982
교문중학교,경기도 구리시 교문동 808-2,37.588349,127.1338889
인창중학교,경기도 구리시 인창동 669-2,37.6065149,127.1463862
토평중학교,경기도 구리시 토평동 963,37.5897143,127.1444377
의정부중학교,경기도 의정부시 가능동 652-56,37.7476057,127.0393664
의정부여자중학교,경기도 의정부시 가능동 653-24,37.7495546,127.039693
동암중학교,경기도 의정부시 장암동 9-24,37.722088,127.0582759
신곡중학교,경기도 의정부시 신곡동 685-2,37.7428881,127.0599758
발곡중학교,경기도 의정부시 신곡동 724-3,37.7271146,127.0547524
부용중학교,경기도 의정부시 민락동 757-2,37.7352443,127.0918051
문산수억중학교,경기도 파주시 파주읍 봉서리 1,37.8508244,126.8029451
대관령중학교,강원도 평창군 대관령면 횡계리 340-1,37.671296,128.7068077
문산동중학교,경기도 파주시 문산읍 당동리 140,37.8594564,126.7813297
파주광일중학교,경기도 파주시 월롱면 영태리 535,37.7748697,126.787394
광탄중학교,경기도 파주시 광탄면 신산리 232,37.7827524,126.8488722
탄현중학교,경기도 파주시 탄현면 축현리 577-1,37.8043805,126.7229336
파평중학교,경기도 파주시 파평면 금파리 288,37.9203093,126.8377422
어유중학교,경기도 파주시 적성면 어유지리 306,37.9937042,126.9876843
파주중학교,경기도 파주시 파주읍 연풍리 445,37.8321646,126.8302686
송내중앙중학교,경기도 동두천시 송내동 665,37.8881249,127.0524734
생연중학교,경기도 동두천시 생연동 714-4,37.8965093,127.049751
신흥중학교,경기도 동두천시 안흥동 36,37.9302869,127.0473982
동두천중학교,경기도 동두천시 생연동 472-3,37.9052678,127.059183
동두천여자중학교,경기도 동두천시 생연동 471-2,37.9064521,127.0603822
보영여자중학교,경기도 동두천시 생연동 522-1,37.9116643,127.0610716
회천중학교,경기도 양주시 고암동 122-2,37.8323541,127.0708618
덕현중학교,경기도 양주시 고읍동 79-33,37.8001137,127.0799384
덕계중학교,경기도 양주시 덕계동 406-2,37.8162072,127.05028
고암중학교,경기도 양주시 덕정동 210,37.8342071,127.0680787
덕정중학교,경기도 양주시 덕정동 151-10,37.8421535,127.0634683
