name,address,lat,lng
안산양지초등학교,경기도 안산시 단원구 고잔동 781-1,37.304744,126.8347977
시곡초등학교,경기도 안산시 상록구 사2동 1344-2,37.2888533,126.8524523
본오초등학교,경기도 안산시 상록구 본오동 821,37.2945332,126.8686756
본원초등학교,경기도 안산시 상록구 본오동 902,37.2911685,126.8619834
각골초등학교,경기도 안산시 상록구 본오동 728-6,37.292617,126.8733488
팔곡초등학교,경기도 안산시 상록구 팔곡이동 385,37.297364,126.8828454
반월초등학교,경기도 안산시 상록구 건건동 629,37.3053721,126.9013972
안산창촌초등학교,경기도 안산시 상록구 건건동 619,37.3076922,126.9045574
안산초등학교,경기도 안산시 상록구 수암동 177,37.3647522,126.8780946
상록초등학교,경기도 안산시 상록구 본오3동 872-1,37.2988338,126.8659152
이호초등학교,경기도 안산시 상록구 본오1동 958,37.2867093,126.8605965
정재초등학교,경기도 안산시 상록구 부곡동 225-5,37.3381245,126.86441
안산부곡초등학교,경기도 안산시 상록구 부곡동 680,37.3290221,126.8601242
시랑초등학교,경기도 안산시 상록구 부곡동 719-3,37.3361983,126.8558662
석호초등학교,경기도 안산시 상록구 사동 1193,37.3008045,126.8482209
초당초등학교,경기도 안산시 상록구 사동 1389,37.2853572,126.8511097
경일초등학교,경기도 안산시 상록구 성포동 591-1,37.323922,126.8476819
성포초등학교,경기도 안산시 상록구 성포동 592-1,37.3240429,126.8425364
경수초등학교,경기도 안산시 상록구 성포동 594-3,37.3269927,126.8506091
삼일초등학교,경기도 안산시 상록구 월피동 448-1,37.3323379,126.8506431
안산광덕초등학교,경기도 안산시 상록구 월피동 523,37.3328862,126.8438782
학현초등학교,경기도 안산시 상록구 이동 665-1,37.3108044,126.8470585
대전가장초등학교,대전광역시 서구 가장동 25-1,36.3305372,127.3878807
신곡초등학교,경기도 김포시 고촌읍 신곡리 1267,37.5965423,126.7660891
증포초등학교,경기도 이천시 증포동 477,37.2942755,127.4569669
마송중앙초등학교,경기도 김포시 통진읍 마송리 499,37.6894042,126.5939745
마송초등학교,경기도 김포시 통진읍 마송리 1-2,37.6844267,126.6065505
서암초등학교,경기도 김포시 통진읍 서암리 412,37.6998586,126.6048445
통진초등학교,경기도 김포시 통진읍 서암리 1108,37.6937255,126.5944372
금란초등학교,경기도 김포시 고촌읍 풍곡리 466-2,37.6075672,126.7511726
학운초등학교,경기도 김포시 양촌읍 학운리 2825,37.6209923,126.6246349
양곡초등학교,경기도 김포시 양촌읍 양곡리 432-10,37.6554203,126.6223801
신양초등학교,경기도 김포시 양촌읍 양곡리 1257,37.6558897,126.6340895
수남초등학교,경기도 김포시 대곶면 대벽리 47,37.6286405,126.5886391
김포대명초등학교,경기도 김포시 대곶면 대명리 366-1,37.6482705,126.5534235
대곶초등학교,경기도 김포시 대곶면 율생리 444,37.6520092,126.584605
석정초등학교,경기도 김포시 대곶면 석정리 381,37.6735637,126.5543499
옹정초등학교,경기도 김포시 통진읍 옹정리 167-45,37.6939437,126.5639212
개곡초등학교,경기도 김포시 월곶면 개곡리 267-2,37.7321415,126.5934648
월곶초등학교,경기도 김포시 월곶면 군하리 218,37.7171647,126.5515984
하성초등학교,경기도 김포시 하성면 마곡리 617-1,37.7201072,126.6328442
금성초등학교,경기도 김포시 하성면 마조리 434,37.7444048,126.6326701
설봉초등학교,경기도 이천시 창전동 501,37.2845242,127.4527739
이천송정초등학교,경기도 이천시 송정동 375-23,37.294211,127.4332251
안흥초등학교,경기도 이천시 안흥동 344-1,37.2802439,127.4566953
한내초등학교,경기도 이천시 증포동 70-5,37.2900422,127.4616542
이천단월초등학교,경기도 이천시 단월동 182-3,37.2273955,127.4512476
이천남초등학교,경기도 이천시 중리동 455,37.2765272,127.444115
창현초등학교,경기도 남양주시 화도읍 창현리 766,37.6455702,127.3021146
진접초등학교,경기도 남양주시 진접읍 금곡리 1109,37.717068,127.1998041
주곡초등학교,경기도 남양주시 진접읍 금곡리 1004,37.7246868,127.2059047
화봉초등학교,경기도 남양주시 진접읍 금곡리 1078,37.7158418,127.1917528
풍양초등학교,경기도 남양주시 진접읍 내각리 670-2,37.7019183,127.1616591
부평초등학교,경기도 남양주시 진접읍 부평리 761,37.7379566,127.2015312
장승초등학교,경기도 남양주시 진접읍 장현리 49-10,37.730086,127.1955462
장현초등학교,경기도 남양주시 진접읍 장현리 379,37.7191728,127.1821886
광릉초등학교,경기도 남양주시 진접읍 팔야리 762,37.7456089,127.2072701
어람초등학교,경기도 남양주시 오남읍 오남리 358-5,37.6823929,127.2127379
남양주양지초등학교,경기도 남양주시 오남읍 양지리 70,37.6993196,127.2067872
성산초등학교,경기도 오산시 오산동 529,37.149812,127.0664914
양오초등학교,경기도 남양주시 오남읍 양지리 616-5,37.6974473,127.1924284
오남초등학교,경기도 남양주시 오남읍 오남리 134-1,37.6953613,127.2144607
예봉초등학교,경기도 남양주시 와부읍 덕소리 252,37.5923181,127.2213182
와부초등학교,경기도 남양주시 와부읍 덕소리 75-5,37.5863257,127.2185385
덕소초등학교,경기도 남양주시 와부읍 덕소리 431-1,37.5880755,127.2147157
남양주월문초등학교,경기도 남양주시 와부읍 월문리 269-1,37.6091305,127.2618725
도심초등학교,경기도 남양주시 와부읍 도곡리 1051-7,37.5805477,127.2277922
남양주도곡초등학교,경기도 남양주시 와부읍 도곡리 산46-7,37.5795829,127.2180881
심석초등학교,경기도 남양주시 화도읍 마석우리 215-1,37.6575523,127.3070509
마석초등학교녹촌분교장,경기도 남양주시 화도읍 녹촌리 272,37.6520807,127.2864889
화접초등학교,경기도 남양주시 별내동 1075,37.6530546,127.115982
별내초등학교,경기도 남양주시 별내면 청학리 408-2,37.7111183,127.1184119
근화초등학교,강원도 춘천시 근화동 802-14,37.8891154,127.7229904
호반초등학교,강원도 춘천시 후평동 15,37.8745534,127.7607372
신남초등학교,강원도 춘천시 칠전동 149,37.8425095,127.7117582
신동초등학교,강원도 춘천시 신동 735-4,37.9301435,127.7228565
석사초등학교,강원도 춘천시 석사동 339,37.8578855,127.7494217
봄내초등학교,강원도 춘천시 석사동 815,37.8558293,127.7419298
성림초등학교,강원도 춘천시 석사동 868,37.8522402,127.7403494
우석초등학교,강원도 춘천시 석사동 754,37.8645242,127.749873
남춘천초등학교,강원도 춘천시 온의동 550,37.8609726,127.7221078
소양초등학교,강원도 춘천시 우두동 282-1,37.9047504,127.7399293
남부초등학교,강원도 춘천시 퇴계동 915,37.8587926,127.7267045
동춘천초등학교,강원도 춘천시 효자동 44-3,37.8772184,127.7428554
부안초등학교,강원도 춘천시 후평동 474-3,37.8766743,127.7498895
후평초등학교,강원도 춘천시 후평동 511-36,37.8827158,127.7441564
동부초등학교,강원도 춘천시 후평동 894,37.8708167,127.7547818
성원초등학교,강원도 춘천시 퇴계동 1035,37.8482999,127.7445837
천전초등학교,강원도 춘천시 신북읍 율문리 295,37.9273882,127.7455084
오동초등학교,강원도 춘천시 신북읍 발산리 473-2,37.9514188,127.7581622
상천초등학교,강원도 춘천시 신북읍 천전리 170,37.9335917,127.7854241
금병초등학교,강원도 춘천시 신동면 증리 360-1,37.815166,127.7144437
금산초등학교,강원도 춘천시 서면 금산리 472-1,37.9032493,127.6995872
당림초등학교,강원도 춘천시 서면 당림리 414-1,37.83763,127.607843
서상초등학교,강원도 춘천시 서면 신매리 329-1,37.9289032,127.7072893
조양초등학교,강원도 춘천시 동산면 조양리 371-1,37.7512003,127.7956209
다문초등학교,경기도 양평군 용문면 다문리 626,37.4857915,127.591646
대전봉산초등학교,대전광역시 서구 갈마동 389,36.3453547,127.3652674
대전선암초등학교,대전광역시 서구 관저동 1152,36.2971614,127.3335346
대전구봉초등학교,대전광역시 서구 관저동 1133,36.2995259,127.329404
대전금동초등학교,대전광역시 서구 관저동 1141,36.2980967,127.3255769
대전관저초등학교,대전광역시 서구 관저동 992,36.3062177,127.3393344
대전느리울초등학교,대전광역시 서구 관저동 1396,36.2982387,127.3434834
대전도마초등학교,대전광역시 서구 도마동 27,36.324416,127.371193
대전유천초등학교,대전광역시 서구 도마동 149-1,36.3148101,127.3751801
대전둔산초등학교,대전광역시 서구 둔산동 1205,36.3499295,127.3808805
한밭초등학교,대전광역시 서구 둔산동 1386,36.353948,127.393991
대전만년초등학교,대전광역시 서구 만년동 280,36.3665863,127.3768245
대전둔천초등학교,대전광역시 서구 만년동 8,36.3680343,127.373607
대전서부초등학교,대전광역시 서구 변동 254-439,36.3330337,127.3689749
대전복수초등학교,대전광역시 서구 복수동 272,36.307763,127.3766871
대전문정초등학교,대전광역시 서구 둔산동 1813,36.3504964,127.3954423
대전삼천초등학교,대전광역시 서구 둔산동 1807,36.3540132,127.4004394
대전성천초등학교,대전광역시 서구 월평동 221,36.3626823,127.3731072
대전성룡초등학교,대전광역시 서구 월평동 304,36.3614641,127.3730175
대전정림초등학교,대전광역시 서구 정림동 638,36.3031283,127.3661454
대전신계초등학교,대전광역시 서구 복수동 452,36.3017349,127.3778721
대전삼육초등학교,대전광역시 서구 도마동 163-11,36.3116739,127.3725847
대전상원초등학교,대전광역시 유성구 상대동 485,36.3425014,127.3329754
중남초등학교,울산광역시 울주군 삼남면 신화리 1485-17,35.5365503,129.1082363
성신초등학교,경기도 고양시 덕양구 행신동 929,37.6265954,126.8403046
행신초등학교,경기도 고양시 덕양구 행신동 983-1,37.6217063,126.8369934
행주초등학교,경기도 고양시 덕양구 행주내동 175,37.6033209,126.8246973
대곡초등학교,경기도 고양시 덕양구 대장동 226-2,37.6410069,126.8126151
백양초등학교,경기도 고양시 덕양구 화정동 990,37.6317619,126.8361005
지도초등학교,경기도 고양시 덕양구 화정동 1132,37.6279291,126.8339171
고양화수초등학교,경기도 고양시 덕양구 화정동 860,37.6451448,126.8327312
화중초등학교,경기도 고양시 덕양구 화정동 871,37.6405369,126.8359978
고양화정초등학교,경기도 고양시 덕양구 화정동 942,37.6337354,126.826111
용정초등학교,경기도 고양시 덕양구 화정동 918,37.6402842,126.8295772
고양초등학교,경기도 고양시 덕양구 고양동 236,37.7030317,126.8999337
목암초등학교,경기도 고양시 덕양구 고양동 722,37.714005,126.90466
성라초등학교,경기도 고양시 덕양구 성사동 732,37.6523492,126.8336507
내유초등학교,경기도 고양시 덕양구 내유동 431-7,37.7153948,126.8518566
고양관산초등학교,경기도 고양시 덕양구 관산동 995,37.6919217,126.8665469
성사초등학교,경기도 고양시 덕양구 성사동 716,37.6576405,126.8443046
능곡초등학교,경기도 고양시 덕양구 토당동 278-2,37.6244511,126.8158009
토당초등학교,경기도 고양시 덕양구 토당동 409-12,37.6172937,126.8263013
소만초등학교,경기도 고양시 덕양구 행신동 780,37.6174786,126.8397551
가람초등학교,경기도 고양시 덕양구 행신동 926,37.6233972,126.8421894
남양주덕송초등학교,경기도 남양주시 별내동 813,37.6693466,127.115854
가운초등학교,경기도 남양주시 가운동 677,37.6007077,127.1557955
금교초등학교,경기도 남양주시 도농동 2-17,37.6139033,127.1614686
구룡초등학교,경기도 남양주시 호평동 722,37.6581346,127.2526276
이동초등학교,경기도 포천시 이동면 장암리 253-1,38.028608,127.3684761
청성초등학교,경기도 포천시 군내면 직두리 740,37.874679,127.2233735
영중초등학교,경기도 포천시 영중면 성동리 891-3,38.0146045,127.2484027
영평초등학교,경기도 포천시 영중면 영평리 240,38.0160884,127.2175359
금주초등학교,경기도 포천시 영중면 금주리 522-1,37.9734698,127.2605337
영북초등학교,경기도 포천시 영북면 운천리 342-2,38.0904351,127.2763111
왕방초등학교,경기도 포천시 신읍동 228,37.9042268,127.2023337
외북초등학교,경기도 포천시 신북면 계류리 54-3,37.9465626,127.1874841
신북초등학교,경기도 포천시 신북면 신평리 375,37.9383955,127.220236
창수초등학교,경기도 포천시 창수면 추동리 117-2,37.9897631,127.1819653
관인초등학교,경기도 포천시 관인면 탄동리 664-1,38.1567607,127.2511476
포천삼정초등학교,경기도 포천시 신북면 삼정리 405-1,37.9640567,127.1314589
중리초등학교,경기도 포천시 관인면 중리 209-2,38.1055942,127.2044288
가평마장초등학교,경기도 가평군 가평읍 마장리 357,37.8600748,127.5146007
가평초등학교,경기도 가평군 가평읍 읍내리 553,37.8307432,127.5074893
상색초등학교,경기도 가평군 가평읍 상색리 171-2,37.8052976,127.4850606
대성초등학교,경기도 가평군 청평면 대성리 399-16,37.682755,127.3777147
상천초등학교,경기도 가평군 청평면 상천리 1338,37.7703749,127.456233
청평초등학교,경기도 가평군 설악면 청평리 527 이투스학원,37.7377012,127.4218861
율길초등학교,경기도 가평군 상면 율길리 454-1,37.8377414,127.2884746
연하초등학교,경기도 가평군 상면 연하리 452-1,37.8031925,127.3425054
상면초등학교,경기도 가평군 상면 임초리 445-3,37.7760635,127.3711377
조종초등학교,경기도 가평군 하면 현리 276,37.8213646,127.3490916
목동초등학교,경기도 가평군 북면 이곡리 13-45,37.8799032,127.5492824
조현초등학교,경기도 양평군 용문면 조현리 171-1,37.5225264,127.6161339
양평단월초등학교,경기도 양평군 단월면 보룡리 346-1,37.5393241,127.6726809
청운초등학교,경기도 양평군 청운면 용두리 510-2,37.5545705,127.7133847
곡수초등학교,경기도 양평군 지평면 곡수리 387-1,37.4183557,127.6114885
지평초등학교,경기도 양평군 지평면 지평리 502-2,37.4756212,127.6377367
양동초등학교,경기도 양평군 양동면 석곡리 190,37.4304294,127.7498853
개군초등학교,경기도 양평군 개군면 하자포리 276-1,37.4278354,127.5343465
강상초등학교,경기도 양평군 강상면 신화리 242,37.4735728,127.4791525
세월초등학교,경기도 양평군 강상면 세월리 126-1,37.4364668,127.494659
강하초등학교,경기도 양평군 강하면 운심리 43-2,37.4963562,127.4094414
수입초등학교,경기도 양평군 서종면 수입리 673,37.6448297,127.3753105
정배초등학교,경기도 양평군 서종면 정배리 330,37.6028528,127.4229609
양동초등학교고송분교장,경기도 양평군 양동면 고송리 821-1,37.48657,127.6999157
모당초등학교,경기도 고양시 일산동구 중산동 1684,37.6795306,126.7813027
하늘초등학교,경기도 고양시 일산동구 중산동 1799,37.6772518,126.7901368
풍산초등학교,경기도 고양시 일산동구 풍동 1284,37.6663923,126.7969663
다솜초등학교,경기도 고양시 일산동구 풍동 1232,37.6725071,126.7966637
풍동초등학교,경기도 고양시 일산동구 풍동 1266,37.669396,126.802608
고양백석초등학교,경기도 고양시 일산동구 백석동 1188,37.6517894,126.7892804
새금초등학교,경기도 파주시 금촌동 1018,37.7480758,126.7731682
저동초등학교,경기도 고양시 일산동구 정발산동 688,37.6678704,126.7742276
벽제초등학교,경기도 고양시 일산동구 사리현동 122-2,37.6958611,126.8435253
성석초등학교,경기도 고양시 일산동구 문봉동 203-6,37.7072274,126.8122184
백마초등학교,경기도 고양시 일산동구 마두동 718,37.6574752,126.7910808
어룡초등학교,경기도 의정부시 용현동 547-5,37.7477216,127.082246
두서초등학교,울산광역시 울주군 두서면 인보리 459-2,35.6428958,129.1583209
두동초등학교,울산광역시 울주군 두동면 구미리 650-1,35.654758,129.2022579
청량초등학교,울산광역시 울주군 청량면 덕하리 412-2,35.4866403,129.2972355
문수초등학교,울산광역시 울주군 청량면 율리 390,35.5191632,129.2405385
삼정초등학교,울산광역시 울주군 청량면 삼정리 786-1,35.4908353,129.2335528
검단초등학교,울산광역시 울주군 웅촌면 검단리 603-3,35.4576649,129.1775887
웅촌초등학교,울산광역시 울주군 웅촌면 곡천리 304,35.4641775,129.2072259
성동초등학교,울산광역시 울주군 서생면 서생리 387,35.3854334,129.3417183
명산초등학교,울산광역시 울주군 서생면 명산리 504,35.3509377,129.2957917
서생초등학교,울산광역시 울주군 서생면 신암리 223,35.3492421,129.3270707
삼동초등학교,울산광역시 울주군 삼동면 하잠리 953-2,35.5239153,129.15911
상북초등학교소호분교,울산광역시 울주군 상북면 소호리 376-3,35.6705174,129.0862809
곡정초등학교,경기도 수원시 권선구 권선동 1358,37.2408603,127.02569
선행초등학교,경기도 수원시 권선구 권선동 1331,37.2542509,127.0256718
수원중촌초등학교,경기도 수원시 권선구 금곡동 303-1,37.2724561,126.9443743
능실초등학교,경기도 수원시 권선구 호매실동 1012,37.2597345,126.9559537
광교초등학교,경기도 수원시 영통구 이의동 1208,37.3037928,127.0458393
이의초등학교,경기도 수원시 영통구 하동 993,37.2929807,127.0754579
수성초등학교,경기도 수원시 장안구 조원동 843,37.3055569,127.0140079
송원초등학교,경기도 수원시 장안구 조원동 872,37.3083092,127.0099383
한일초등학교,경기도 수원시 장안구 조원동 882,37.3069114,127.005405
효천초등학교,경기도 수원시 장안구 정자동 923,37.2932545,126.9866305
야탑초등학교,경기도 성남시 분당구 야탑동 333,37.4163135,127.1258841
덕도초등학교,경기도 양주시 광적면 석우리 525-14,37.8404432,126.9772642
봉암초등학교,경기도 양주시 은현면 봉암리 403-3,37.9105075,127.0058675
상패초등학교,경기도 양주시 은현면 하패리 796-4,37.8978836,127.026507
은현초등학교,경기도 양주시 은현면 선암리 553-2,37.8643435,127.0230776
상수초등학교,경기도 양주시 남면 상수리 443-2,37.8686306,126.987733
남면초등학교,경기도 양주시 남면 신산리 286-2,37.8940365,126.9750617
남면초등학교양덕분교장,경기도 양주시 남면 한산리 272-1,37.9086297,126.9986702
선단초등학교,경기도 포천시 선단동 765-1,37.8616424,127.1553556
포천초등학교,경기도 포천시 신읍동 133,37.8967586,127.1971839
안미초등학교,강원도 평창군 대화면 하안미리 1635,37.4600968,128.4344101
이곡초등학교,경기도 포천시 소흘읍 이곡리 197,37.7782698,127.1488568
추산초등학교,경기도 포천시 소흘읍 송우리 728-11,37.8257644,127.1367147
태봉초등학교,경기도 포천시 소흘읍 송우리 725-4,37.8345186,127.1448833
신봉초등학교,경기도 포천시 소흘읍 송우리 727-4,37.8318531,127.1388931
송우초등학교,경기도 포천시 소흘읍 송우리 214,37.8295161,127.1433847
축석초등학교,경기도 포천시 소흘읍 이동교리 645,37.7881923,127.1221079
유암초등학교,경기도 포천시 가산면 감암리 503-1,37.8684898,127.1926256
정교초등학교,경기도 포천시 가산면 정교리 549-2,37.8152429,127.1696832
가산초등학교,경기도 포천시 가산면 마산리 606-2,37.8479307,127.1850433
내촌초등학교,경기도 포천시 내촌면 내리 316-1,37.7868827,127.2300704
지현초등학교,경기도 포천시 화현면 지현리 279-6,37.9285908,127.2648387
화현초등학교,경기도 포천시 화현면 화현리 847-1,37.9018988,127.2846733
일동초등학교,경기도 포천시 일동면 기산리 281-1,37.9549201,127.3145087
운담초등학교,경기도 포천시 일동면 화대리 608-2,37.9719185,127.3295571
포천노곡초등학교,경기도 포천시 이동면 노곡리 846-6,38.0081356,127.3353887
마전초등학교,경기도 안성시 삼죽면 마전리 37-1,37.0306966,127.3413202
삼죽초등학교,경기도 안성시 삼죽면 덕산리 269,37.0759917,127.3737018
광선초등학교,경기도 안성시 죽산면 두교리 265-3,37.008057,127.4335311
죽산초등학교,경기도 안성시 죽산면 죽산리 405-2,37.0775743,127.4210266
일죽초등학교,경기도 안성시 일죽면 주천리 300,37.0921024,127.481942
방초초등학교,경기도 안성시 일죽면 방초리 459-2,37.1197988,127.4335344
죽화초등학교,경기도 안성시 일죽면 화곡리 730,37.1074878,127.4583336
고삼초등학교,경기도 안성시 고삼면 가유리 329-1,37.0825482,127.2645138
양성초등학교,경기도 안성시 양성면 동항리 408-1,37.0613816,127.1951381
미곡초등학교,경기도 안성시 양성면 노곡리 443,37.1104881,127.2451615
원곡초등학교성은분교장,경기도 안성시 원곡면 성은리 35-1,37.0770979,127.1600742
금광초등학교조령분교장,경기도 안성시 금광면 사흥리 631-2,37.0009596,127.3579576
보개초등학교가율분교장,경기도 안성시 보개면 이전리 347-2,37.0601739,127.2958626
세종초등학교,경기도 여주시 교동 121-7,37.2796966,127.6337573
연라초등학교,경기도 여주시 월송동 313-42,37.277869,127.6115737
점봉초등학교,경기도 여주시 점봉동 336,37.2569409,127.6448474
여흥초등학교,경기도 여주시 상동 108,37.2936942,127.643728
여주초등학교,경기도 여주시 창동 8,37.2985007,127.6359788
오학초등학교,경기도 여주시 오학동 105-1,37.3124123,127.6473969
매류초등학교,경기도 여주시 능서면 마래리 143,37.2736696,127.5574367
능북초등학교,경기도 여주시 능서면 백석리 442,37.3331316,127.5919594
능서초등학교,경기도 여주시 능서면 신지리 786-1,37.2979453,127.5720938
문장초등학교,경기도 여주시 흥천면 문장리 373-1,37.3607109,127.5122459
흥천초등학교,경기도 여주시 흥천면 효지리 377-3,37.3323515,127.5412161
이포초등학교,경기도 여주시 금사면 이포리 311-2,37.3886539,127.530078
송양초등학교,경기도 의정부시 낙양동 205,37.7528188,127.1117452
민락초등학교,경기도 의정부시 민락동 692-2,37.7418086,127.0947772
의정부부용초등학교,경기도 의정부시 민락동 756-6,37.7361653,127.0908863
금릉초등학교,경기도 파주시 금촌동 994,37.7523441,126.7729389
금신초등학교,경기도 파주시 금촌동 369-1,37.7670547,126.7718109
금향초등학교,경기도 파주시 금촌동 1007,37.7525118,126.7769419
검산초등학교,경기도 파주시 검산동 548-2,37.7761017,126.7394579
파주송화초등학교,경기도 파주시 아동동 277,37.7746351,126.7790524
금화초등학교,경기도 파주시 금촌동 974,37.755104,126.7680251
금촌초등학교,경기도 파주시 금촌동 929-1,37.7617985,126.7697527
동패초등학교,경기도 파주시 동패동 1795,37.7173897,126.74001
석곶초등학교,경기도 파주시 동패동 1700,37.7250555,126.7222525
문발초등학교,경기도 파주시 문발동 555,37.725698,126.7067917
지산초등학교,경기도 파주시 와동동 1339-5,37.7313601,126.7617476
한가람초등학교,경기도 파주시 와동동 1318,37.7318838,126.7558625
한빛초등학교,경기도 파주시 야당동 983,37.71465,126.7509672
덕암초등학교,경기도 파주시 조리읍 뇌조리 457-1,37.7647407,126.8196307
능안초등학교,경기도 파주시 조리읍 능안리 53-6,37.740584,126.7928293
파주대원초등학교,경기도 파주시 조리읍 대원리 203,37.7272467,126.8192952
봉일천초등학교,경기도 파주시 조리읍 봉일천리 191-6,37.7450284,126.8072467
교하초등학교,경기도 파주시 교하동 337,37.7538678,126.747313
청석초등학교,경기도 파주시 다율동 983,37.731051,126.7192795
청암초등학교,경기도 파주시 목동동 868,37.730981,126.7378741
가산초등학교,강원도 춘천시 동면 지내리 136-2,37.908693,127.782582
이매초등학교,경기도 성남시 분당구 이매동 112,37.3967336,127.1259418
성남장안초등학교,경기도 성남시 분당구 분당동 91,37.372132,127.1441451
한솔초등학교,경기도 성남시 분당구 정자동 113,37.3666226,127.1178573
늘푸른초등학교,경기도 성남시 분당구 정자동 178-5,37.3579592,127.1053044
중탑초등학교,경기도 성남시 분당구 야탑동 212,37.4136197,127.1394714
돌마초등학교,경기도 성남시 분당구 야탑동 515,37.4089552,127.1300247
하탑초등학교,경기도 성남시 분당구 야탑동 531,37.4070081,127.1262519
